{
  "qa_schema_version": "1.0",
  "artifact_type": "grade-4-canonical-source-qa",
  "source_id": "grade-4-estonian-second-language",
  "source_archive": "project-files/inputs/final-zips/opiq_4klass_eesti_keel_4_klassile_opiq_v2.zip",
  "output_file": "project-files/outputs/opiq_4klass_eesti_keel_teise_keelena.md",
  "format_version": "2.0",
  "generation": {
    "status": "generated",
    "generated_at": "2026-07-23T11:57:57.782Z",
    "generator": "scripts/generate-grade-4-sources.mjs",
    "generator_version": "1.0",
    "note": "Generated deterministically from immutable ZIP rows classified as instructional; post-audit Kit Details evidence is referenced separately."
  },
  "checksums": {
    "source_archive_sha256": "a8a2c589252fc15c73175d009754136664c56858241742cd7d1d6c97203460db",
    "output_file_sha256": "860bf9014f3cfeb328c47a7f84b2ce810c53789fa94d521a79bbecde88b15c2b"
  },
  "included_zip_archives": [
    {
      "path": "project-files/inputs/final-zips/opiq_4klass_eesti_keel_4_klassile_opiq_v2.zip",
      "sha256": "a8a2c589252fc15c73175d009754136664c56858241742cd7d1d6c97203460db",
      "byte_size": 2942291
    }
  ],
  "included_kit_ids": [
    "150"
  ],
  "excluded_kit_ids": [
    "154",
    "533",
    "71"
  ],
  "source_book_ids": [
    "teele._eesti_keel_teise_keelena_4._klassile"
  ],
  "source_records": 119,
  "page_records_included": 117,
  "administrative_records_excluded": 0,
  "kit_details_records_excluded": 1,
  "duplicate_detail_aliases_excluded": 1,
  "duplicate_instructional_urls_excluded": 0,
  "malformed_or_ambiguous_records_excluded": 0,
  "source_accounting": {
    "total_source_records": 119,
    "instructional_chapter_or_page": 117,
    "kit_or_book_detail": 1,
    "administrative_or_imprint": 0,
    "duplicate_detail_alias": 1,
    "duplicate_instructional_url": 0,
    "malformed_or_ambiguous": 0,
    "accounted_source_records": 119,
    "balanced": true
  },
  "grades": {
    "4": 117
  },
  "languages": {
    "et": 117
  },
  "books": {
    "teele._eesti_keel_teise_keelena_4._klassile__kit150": 117
  },
  "kits": {
    "150": 117
  },
  "raw_grade_labels": {
    "4": 119
  },
  "evidence_supported_grade_scope": [
    4
  ],
  "raw_subject_labels": {
    "mathematics / matemaatika / математика": 118,
    "science / loodusõpetus / природоведение": 1
  },
  "canonical_subject": {
    "en": "Estonian as a second language",
    "et": "eesti keel teise keelena",
    "ru": "эстонский язык как второй"
  },
  "subject_normalization": {
    "source_rows_with_exporter_mathematics_alias": 118,
    "canonical_subject": "Estonian as a second language / eesti keel teise keelena / эстонский язык как второй",
    "visible_instructional_text_changed": false
  },
  "programme_type": "unknown",
  "programme_evidence": [
    "Programme type is not established by the supplied evidence and remains unknown."
  ],
  "edition_distinctions": [],
  "metadata_contradictions": [
    "118 route-scoped source rows carry the exporter-generated mathematics subject and are normalized from kit/book evidence."
  ],
  "kit_details_evidence_refs": [
    "evaluations/grade-4-source-intake.json#kit:150"
  ],
  "url_ownership": {
    "require_unique": true,
    "canonical_url_count": 117,
    "duplicate_within_route_count": 0,
    "cross_grade4_route_overlap_count": 0
  },
  "task_availability": {
    "records_with_captured_task_examples": 0,
    "records_without_captured_task_examples": 117,
    "task_level_complete": false,
    "task_bodies_synthesized": false
  },
  "page_prose_availability": {
    "complete_page_prose_captured": false,
    "records_with_complete_page_prose": 0
  },
  "captured_markup": {
    "records_with_html_or_mathml_fragments": 0,
    "markup_preserved_as_source_evidence": true
  },
  "known_limitations": [
    "Complete instructional page prose is not present in the raw chapter objects.",
    "Task examples are incomplete for some or all books; no task content is synthesized.",
    "Exporter-generated translated topics are query metadata, not proof of page-language prose.",
    "Current live-catalogue and official-curriculum completeness are not established."
  ]
}
