{
  "qa_schema_version": "1.0",
  "artifact_type": "grade-4-canonical-source-qa",
  "source_id": "grade-4-mathematics",
  "source_archive": "project-files/inputs/final-zips/opiq_4klass_matemaatika_4_klassile_opiq_v2.zip",
  "output_file": "project-files/outputs/opiq_4klass_matemaatika.md",
  "format_version": "2.0",
  "generation": {
    "status": "generated",
    "generated_at": "2026-07-24T07:54:47.499Z",
    "generator": "scripts/generate-grade-4-sources.mjs",
    "generator_version": "1.0",
    "note": "Generated deterministically from immutable ZIP rows classified as instructional; post-audit Kit Details evidence is referenced separately."
  },
  "checksums": {
    "source_archive_sha256": "b5441563b40d35e74b66b53bba72767ae4829da31d380a4079effd9054d15225",
    "output_file_sha256": "5813c94ef4b0f708e2c1ce63adc2f62e88ce4a776787e4f0dbb51b7c3f09bdeb"
  },
  "included_zip_archives": [
    {
      "path": "project-files/inputs/final-zips/opiq_4klass_matemaatika_4_klassile_opiq_v2.zip",
      "sha256": "b5441563b40d35e74b66b53bba72767ae4829da31d380a4079effd9054d15225",
      "byte_size": 7363275
    }
  ],
  "included_kit_ids": [
    "70",
    "147",
    "157",
    "293",
    "460",
    "588"
  ],
  "excluded_kit_ids": [
    "282",
    "304",
    "318",
    "328"
  ],
  "source_book_ids": [
    "matemaatika_4._klassile",
    "matemaatika_4._klassile_(2025)",
    "matemaatika_4._klassile_2",
    "matemaatika_4._klassile_2023_õk",
    "математика_4_класс",
    "математика_для_4_класса"
  ],
  "source_records": 580,
  "page_records_included": 567,
  "administrative_records_excluded": 2,
  "kit_details_records_excluded": 6,
  "duplicate_detail_aliases_excluded": 5,
  "duplicate_instructional_urls_excluded": 0,
  "malformed_or_ambiguous_records_excluded": 0,
  "source_accounting": {
    "total_source_records": 580,
    "instructional_chapter_or_page": 567,
    "kit_or_book_detail": 6,
    "administrative_or_imprint": 2,
    "duplicate_detail_alias": 5,
    "duplicate_instructional_url": 0,
    "malformed_or_ambiguous": 0,
    "accounted_source_records": 580,
    "balanced": true
  },
  "grades": {
    "4": 567
  },
  "languages": {
    "en": 4,
    "et": 377,
    "ru": 186
  },
  "books": {
    "matemaatika_4._klassile_(2025)__kit588": 60,
    "matemaatika_4._klassile_2023_õk__kit460": 128,
    "matemaatika_4._klassile_2__kit147": 62,
    "matemaatika_4._klassile__kit70": 131,
    "математика_4_класс__kit293": 63,
    "математика_для_4_класса__kit157": 123
  },
  "kits": {
    "70": 131,
    "147": 62,
    "157": 123,
    "293": 63,
    "460": 128,
    "588": 60
  },
  "raw_grade_labels": {
    "4": 580
  },
  "evidence_supported_grade_scope": [
    4
  ],
  "raw_subject_labels": {
    "mathematics / matemaatika / математика": 580
  },
  "canonical_subject": {
    "en": "mathematics",
    "et": "matemaatika",
    "ru": "математика"
  },
  "subject_normalization": {
    "source_rows_with_exporter_mathematics_alias": 0,
    "canonical_subject": "mathematics / matemaatika / математика",
    "visible_instructional_text_changed": false
  },
  "programme_type": "unknown",
  "programme_evidence": [
    "Programme type is not established by the supplied evidence and remains unknown."
  ],
  "edition_distinctions": [],
  "metadata_contradictions": [],
  "kit_details_evidence_refs": [
    "evaluations/grade-4-source-intake.json#kit:70",
    "evaluations/grade-4-source-intake.json#kit:147",
    "evaluations/grade-4-source-intake.json#kit:157",
    "evaluations/grade-4-source-intake.json#kit:293",
    "evaluations/grade-4-source-intake.json#kit:460",
    "evaluations/grade-4-source-intake.json#kit:588"
  ],
  "url_ownership": {
    "require_unique": true,
    "canonical_url_count": 567,
    "duplicate_within_route_count": 0,
    "cross_grade4_route_overlap_count": 0
  },
  "task_availability": {
    "records_with_captured_task_examples": 223,
    "records_without_captured_task_examples": 344,
    "task_level_complete": false,
    "task_bodies_synthesized": false
  },
  "page_prose_availability": {
    "complete_page_prose_captured": false,
    "records_with_complete_page_prose": 0
  },
  "captured_markup": {
    "records_with_html_or_mathml_fragments": 6,
    "markup_preserved_as_source_evidence": true
  },
  "known_limitations": [
    "Complete instructional page prose is not present in the raw chapter objects.",
    "Task examples are incomplete for some or all books; no task content is synthesized.",
    "Exporter-generated translated topics are query metadata, not proof of page-language prose.",
    "Current live-catalogue and official-curriculum completeness are not established."
  ]
}
