{
  "qa_schema_version": "1.0",
  "artifact_type": "grade-4-canonical-source-qa",
  "source_id": "grade-4-english",
  "source_archive": "project-files/inputs/final-zips/opiq_4klass_english_step_by_step_2_opiq_v2.zip",
  "output_file": "project-files/outputs/opiq_4klass_inglise_keel.md",
  "format_version": "2.0",
  "generation": {
    "status": "generated",
    "generated_at": "2026-07-23T12:45:06.139Z",
    "generator": "scripts/generate-grade-4-sources.mjs",
    "generator_version": "1.0",
    "note": "Generated deterministically from immutable ZIP rows classified as instructional; post-audit Kit Details evidence is referenced separately."
  },
  "checksums": {
    "source_archive_sha256": "6a33af61d7668f36f26d6c87d56441945a916e1fc21770ded237dd1a388d85ca",
    "output_file_sha256": "977f6fae19e9d5bcf9d3a06d125b1705e45c3bd3c787e825d8a4e90ce6e43800"
  },
  "included_zip_archives": [
    {
      "path": "project-files/inputs/final-zips/opiq_4klass_english_step_by_step_2_opiq_v2.zip",
      "sha256": "6a33af61d7668f36f26d6c87d56441945a916e1fc21770ded237dd1a388d85ca",
      "byte_size": 1557061
    }
  ],
  "included_kit_ids": [
    "332",
    "451"
  ],
  "excluded_kit_ids": [],
  "source_book_ids": [
    "english_step_by_step_2",
    "inglise_keel_4._klassile"
  ],
  "source_records": 168,
  "page_records_included": 163,
  "administrative_records_excluded": 1,
  "kit_details_records_excluded": 2,
  "duplicate_detail_aliases_excluded": 2,
  "duplicate_instructional_urls_excluded": 0,
  "malformed_or_ambiguous_records_excluded": 0,
  "source_accounting": {
    "total_source_records": 168,
    "instructional_chapter_or_page": 163,
    "kit_or_book_detail": 2,
    "administrative_or_imprint": 1,
    "duplicate_detail_alias": 2,
    "duplicate_instructional_url": 0,
    "malformed_or_ambiguous": 0,
    "accounted_source_records": 168,
    "balanced": true
  },
  "grades": {
    "4": 163
  },
  "languages": {
    "en": 112,
    "et": 49,
    "ru": 2
  },
  "books": {
    "english_step_by_step_2__kit332": 69,
    "inglise_keel_4._klassile__kit451": 94
  },
  "kits": {
    "332": 69,
    "451": 94
  },
  "raw_grade_labels": {
    "4": 168
  },
  "evidence_supported_grade_scope": [
    4
  ],
  "raw_subject_labels": {
    "mathematics / matemaatika / математика": 168
  },
  "canonical_subject": {
    "en": "English",
    "et": "inglise keel",
    "ru": "английский язык"
  },
  "subject_normalization": {
    "source_rows_with_exporter_mathematics_alias": 168,
    "canonical_subject": "English / inglise keel / английский язык",
    "visible_instructional_text_changed": false
  },
  "programme_type": "unknown",
  "programme_evidence": [
    "Programme type is not established by the supplied evidence and remains unknown."
  ],
  "edition_distinctions": [],
  "metadata_contradictions": [
    "168 route-scoped source rows carry the exporter-generated mathematics subject and are normalized from kit/book evidence."
  ],
  "kit_details_evidence_refs": [
    "evaluations/grade-4-kit-details-evidence.json#kit:332",
    "evaluations/grade-4-source-intake.json#kit:451"
  ],
  "url_ownership": {
    "require_unique": true,
    "canonical_url_count": 163,
    "duplicate_within_route_count": 0,
    "cross_grade4_route_overlap_count": 0
  },
  "task_availability": {
    "records_with_captured_task_examples": 0,
    "records_without_captured_task_examples": 163,
    "task_level_complete": false,
    "task_bodies_synthesized": false
  },
  "page_prose_availability": {
    "complete_page_prose_captured": false,
    "records_with_complete_page_prose": 0
  },
  "captured_markup": {
    "records_with_html_or_mathml_fragments": 0,
    "markup_preserved_as_source_evidence": true
  },
  "known_limitations": [
    "Complete instructional page prose is not present in the raw chapter objects.",
    "Task examples are incomplete for some or all books; no task content is synthesized.",
    "Exporter-generated translated topics are query metadata, not proof of page-language prose.",
    "Current live-catalogue and official-curriculum completeness are not established.",
    "Kit 332 exact-grade ownership is supported by the separate post-audit Kit Details evidence."
  ]
}
