{
  "qa_schema_version": "1.0",
  "artifact_type": "grade-4-canonical-source-qa",
  "source_id": "grade-4-russian-reading",
  "source_archive": "project-files/inputs/final-zips/opiq_4klass_4_opiq_v2.zip",
  "output_file": "project-files/outputs/opiq_4klass_vene_lugemine.md",
  "format_version": "2.0",
  "generation": {
    "status": "generated",
    "generated_at": "2026-07-23T14:49:42.875Z",
    "generator": "scripts/generate-grade-4-sources.mjs",
    "generator_version": "1.0",
    "note": "Generated deterministically from immutable ZIP rows classified as instructional; post-audit Kit Details evidence is referenced separately."
  },
  "checksums": {
    "source_archive_sha256": "70a784a69b4df6f9081b753d5c5c2f8b89d220f76efb575c3ef6c3f90571bd0f",
    "output_file_sha256": "4c60b25c62e3a26b2f00968a75eca4f4d6b51c0b0b0554ba5657b23662806cf7"
  },
  "included_zip_archives": [
    {
      "path": "project-files/inputs/final-zips/opiq_4klass_4_opiq_v2.zip",
      "sha256": "70a784a69b4df6f9081b753d5c5c2f8b89d220f76efb575c3ef6c3f90571bd0f",
      "byte_size": 2893608
    }
  ],
  "included_kit_ids": [
    "415"
  ],
  "excluded_kit_ids": [
    "243",
    "295"
  ],
  "source_book_ids": [
    "русское_слово._чтение_для_4_клacca"
  ],
  "source_records": 36,
  "page_records_included": 34,
  "administrative_records_excluded": 0,
  "kit_details_records_excluded": 1,
  "duplicate_detail_aliases_excluded": 1,
  "duplicate_instructional_urls_excluded": 0,
  "malformed_or_ambiguous_records_excluded": 0,
  "source_accounting": {
    "total_source_records": 36,
    "instructional_chapter_or_page": 34,
    "kit_or_book_detail": 1,
    "administrative_or_imprint": 0,
    "duplicate_detail_alias": 1,
    "duplicate_instructional_url": 0,
    "malformed_or_ambiguous": 0,
    "accounted_source_records": 36,
    "balanced": true
  },
  "grades": {
    "4": 34
  },
  "languages": {
    "ru": 34
  },
  "books": {
    "русское_слово._чтение_для_4_клacca__kit415": 34
  },
  "kits": {
    "415": 34
  },
  "raw_grade_labels": {
    "4": 36
  },
  "evidence_supported_grade_scope": [
    4
  ],
  "raw_subject_labels": {
    "mathematics / matemaatika / математика": 36
  },
  "canonical_subject": {
    "en": "Russian reading",
    "et": "vene keele lugemine",
    "ru": "русское чтение"
  },
  "subject_normalization": {
    "source_rows_with_exporter_mathematics_alias": 36,
    "canonical_subject": "Russian reading / vene keele lugemine / русское чтение",
    "visible_instructional_text_changed": false
  },
  "programme_type": "unknown",
  "programme_evidence": [
    "Programme type is not established by the supplied evidence and remains unknown."
  ],
  "edition_distinctions": [],
  "metadata_contradictions": [
    "36 route-scoped source rows carry the exporter-generated mathematics subject and are normalized from kit/book evidence."
  ],
  "kit_details_evidence_refs": [
    "evaluations/grade-4-source-intake.json#kit:415"
  ],
  "url_ownership": {
    "require_unique": true,
    "canonical_url_count": 34,
    "duplicate_within_route_count": 0,
    "cross_grade4_route_overlap_count": 0
  },
  "task_availability": {
    "records_with_captured_task_examples": 0,
    "records_without_captured_task_examples": 34,
    "task_level_complete": false,
    "task_bodies_synthesized": false
  },
  "page_prose_availability": {
    "complete_page_prose_captured": false,
    "records_with_complete_page_prose": 0
  },
  "captured_markup": {
    "records_with_html_or_mathml_fragments": 0,
    "markup_preserved_as_source_evidence": true
  },
  "known_limitations": [
    "Complete instructional page prose is not present in the raw chapter objects.",
    "Task examples are incomplete for some or all books; no task content is synthesized.",
    "Exporter-generated translated topics are query metadata, not proof of page-language prose.",
    "Current live-catalogue and official-curriculum completeness are not established."
  ]
}
