{
  "qa_schema_version": "1.0",
  "artifact_type": "grade-4-canonical-source-qa",
  "source_id": "grade-4-russian",
  "source_archive": "project-files/inputs/final-zips/opiq_4klass_4_opiq_v2.zip",
  "output_file": "project-files/outputs/opiq_4klass_vene_keel.md",
  "format_version": "2.0",
  "generation": {
    "status": "generated",
    "generated_at": "2026-07-23T14:49:42.875Z",
    "generator": "scripts/generate-grade-4-sources.mjs",
    "generator_version": "1.0",
    "note": "Generated deterministically from immutable ZIP rows classified as instructional; post-audit Kit Details evidence is referenced separately."
  },
  "checksums": {
    "source_archive_sha256": "70a784a69b4df6f9081b753d5c5c2f8b89d220f76efb575c3ef6c3f90571bd0f",
    "output_file_sha256": "dbc3d5b0f33e72ba5aed9e385b58ca08ffec00231fd56e9fb66e76242633336a"
  },
  "included_zip_archives": [
    {
      "path": "project-files/inputs/final-zips/opiq_4klass_4_opiq_v2.zip",
      "sha256": "70a784a69b4df6f9081b753d5c5c2f8b89d220f76efb575c3ef6c3f90571bd0f",
      "byte_size": 2893608
    }
  ],
  "included_kit_ids": [
    "243",
    "295"
  ],
  "excluded_kit_ids": [
    "415"
  ],
  "source_book_ids": [
    "русский_язык_4_класс",
    "русский_язык_для_4_класса"
  ],
  "source_records": 171,
  "page_records_included": 167,
  "administrative_records_excluded": 0,
  "kit_details_records_excluded": 2,
  "duplicate_detail_aliases_excluded": 2,
  "duplicate_instructional_urls_excluded": 0,
  "malformed_or_ambiguous_records_excluded": 0,
  "source_accounting": {
    "total_source_records": 171,
    "instructional_chapter_or_page": 167,
    "kit_or_book_detail": 2,
    "administrative_or_imprint": 0,
    "duplicate_detail_alias": 2,
    "duplicate_instructional_url": 0,
    "malformed_or_ambiguous": 0,
    "accounted_source_records": 171,
    "balanced": true
  },
  "grades": {
    "4": 167
  },
  "languages": {
    "ru": 167
  },
  "books": {
    "русский_язык_4_класс__kit243": 91,
    "русский_язык_для_4_класса__kit295": 76
  },
  "kits": {
    "243": 91,
    "295": 76
  },
  "raw_grade_labels": {
    "4": 171
  },
  "evidence_supported_grade_scope": [
    4
  ],
  "raw_subject_labels": {
    "mathematics / matemaatika / математика": 171
  },
  "canonical_subject": {
    "en": "Russian language",
    "et": "vene keel",
    "ru": "русский язык"
  },
  "subject_normalization": {
    "source_rows_with_exporter_mathematics_alias": 171,
    "canonical_subject": "Russian language / vene keel / русский язык",
    "visible_instructional_text_changed": false
  },
  "programme_type": "unknown",
  "programme_evidence": [
    "Programme type is not established by the supplied evidence and remains unknown."
  ],
  "edition_distinctions": [],
  "metadata_contradictions": [
    "171 route-scoped source rows carry the exporter-generated mathematics subject and are normalized from kit/book evidence."
  ],
  "kit_details_evidence_refs": [
    "evaluations/grade-4-source-intake.json#kit:243",
    "evaluations/grade-4-source-intake.json#kit:295"
  ],
  "url_ownership": {
    "require_unique": true,
    "canonical_url_count": 167,
    "duplicate_within_route_count": 0,
    "cross_grade4_route_overlap_count": 0
  },
  "task_availability": {
    "records_with_captured_task_examples": 140,
    "records_without_captured_task_examples": 27,
    "task_level_complete": false,
    "task_bodies_synthesized": false
  },
  "page_prose_availability": {
    "complete_page_prose_captured": false,
    "records_with_complete_page_prose": 0
  },
  "captured_markup": {
    "records_with_html_or_mathml_fragments": 2,
    "markup_preserved_as_source_evidence": true
  },
  "known_limitations": [
    "Complete instructional page prose is not present in the raw chapter objects.",
    "Task examples are incomplete for some or all books; no task content is synthesized.",
    "Exporter-generated translated topics are query metadata, not proof of page-language prose.",
    "Current live-catalogue and official-curriculum completeness are not established."
  ]
}
