{
  "qa_schema_version": "1.0",
  "artifact_type": "grade-4-canonical-source-qa",
  "source_id": "grade-4-estonian",
  "source_archive": "project-files/inputs/final-zips/opiq_4klass_eesti_keel_4_klassile_opiq_v2.zip",
  "output_file": "project-files/outputs/opiq_4klass_eesti_keel.md",
  "format_version": "2.0",
  "generation": {
    "status": "generated",
    "generated_at": "2026-07-23T11:57:57.782Z",
    "generator": "scripts/generate-grade-4-sources.mjs",
    "generator_version": "1.0",
    "note": "Generated deterministically from immutable ZIP rows classified as instructional; post-audit Kit Details evidence is referenced separately."
  },
  "checksums": {
    "source_archive_sha256": "a8a2c589252fc15c73175d009754136664c56858241742cd7d1d6c97203460db",
    "output_file_sha256": "2ea69cafe1ef13901979847e58fad943d66bbd730415f4966337b4d4605a7b8b"
  },
  "included_zip_archives": [
    {
      "path": "project-files/inputs/final-zips/opiq_4klass_eesti_keel_4_klassile_opiq_v2.zip",
      "sha256": "a8a2c589252fc15c73175d009754136664c56858241742cd7d1d6c97203460db",
      "byte_size": 2942291
    }
  ],
  "included_kit_ids": [
    "71",
    "154",
    "533"
  ],
  "excluded_kit_ids": [
    "150"
  ],
  "source_book_ids": [
    "eesti_keel_4._klassile",
    "eesti_keel_4._klassile_2024",
    "sinasõprus_keelega"
  ],
  "source_records": 407,
  "page_records_included": 398,
  "administrative_records_excluded": 3,
  "kit_details_records_excluded": 3,
  "duplicate_detail_aliases_excluded": 3,
  "duplicate_instructional_urls_excluded": 0,
  "malformed_or_ambiguous_records_excluded": 0,
  "source_accounting": {
    "total_source_records": 407,
    "instructional_chapter_or_page": 398,
    "kit_or_book_detail": 3,
    "administrative_or_imprint": 3,
    "duplicate_detail_alias": 3,
    "duplicate_instructional_url": 0,
    "malformed_or_ambiguous": 0,
    "accounted_source_records": 407,
    "balanced": true
  },
  "grades": {
    "4": 398
  },
  "languages": {
    "et": 398
  },
  "books": {
    "eesti_keel_4._klassile_2024__kit533": 127,
    "eesti_keel_4._klassile__kit71": 134,
    "sinasõprus_keelega__kit154": 137
  },
  "kits": {
    "71": 134,
    "154": 137,
    "533": 127
  },
  "raw_grade_labels": {
    "4": 407
  },
  "evidence_supported_grade_scope": [
    4
  ],
  "raw_subject_labels": {
    "mathematics / matemaatika / математика": 405,
    "science / loodusõpetus / природоведение": 2
  },
  "canonical_subject": {
    "en": "Estonian language",
    "et": "eesti keel",
    "ru": "эстонский язык"
  },
  "subject_normalization": {
    "source_rows_with_exporter_mathematics_alias": 405,
    "canonical_subject": "Estonian language / eesti keel / эстонский язык",
    "visible_instructional_text_changed": false
  },
  "programme_type": "unknown",
  "programme_evidence": [
    "Programme type is not established by the supplied evidence and remains unknown."
  ],
  "edition_distinctions": [],
  "metadata_contradictions": [
    "405 route-scoped source rows carry the exporter-generated mathematics subject and are normalized from kit/book evidence."
  ],
  "kit_details_evidence_refs": [
    "evaluations/grade-4-source-intake.json#kit:71",
    "evaluations/grade-4-kit-details-evidence.json#kit:154",
    "evaluations/grade-4-source-intake.json#kit:533"
  ],
  "url_ownership": {
    "require_unique": true,
    "canonical_url_count": 398,
    "duplicate_within_route_count": 0,
    "cross_grade4_route_overlap_count": 0
  },
  "task_availability": {
    "records_with_captured_task_examples": 3,
    "records_without_captured_task_examples": 395,
    "task_level_complete": false,
    "task_bodies_synthesized": false
  },
  "page_prose_availability": {
    "complete_page_prose_captured": false,
    "records_with_complete_page_prose": 0
  },
  "captured_markup": {
    "records_with_html_or_mathml_fragments": 0,
    "markup_preserved_as_source_evidence": true
  },
  "known_limitations": [
    "Complete instructional page prose is not present in the raw chapter objects.",
    "Task examples are incomplete for some or all books; no task content is synthesized.",
    "Exporter-generated translated topics are query metadata, not proof of page-language prose.",
    "Current live-catalogue and official-curriculum completeness are not established.",
    "Kit 154 exact-grade ownership is supported by the separate post-audit Kit Details evidence."
  ]
}
